{
  "$schema": "https://json-schema.org/draft/2020-12/schema",
  "$id": "https://docs.artisanmc.net/schema/command/v1.json",
  "title": "Artisan Command",
  "description": "Format intermédiaire d'une commande Artisan. Une commande est une entité de premier ordre (au même niveau que les Menus dans le workspace) qui exécute une séquence d'actions et peut accepter des arguments typés. Les arguments résolus sont propagés comme placeholders aux menus ouverts depuis la commande.",
  "type": "object",
  "additionalProperties": false,
  "required": ["schema", "id", "name", "actions"],
  "properties": {
    "schema": {
      "const": "command/v1",
      "description": "Version du schéma. Verrouillée pour permettre les migrations applicables au load."
    },
    "id": {
      "type": "string",
      "pattern": "^[a-z][a-z0-9_]{0,63}$",
      "description": "Identifiant stable de la commande dans le workspace, utilisé pour les références internes (paquets, redirections, etc.)."
    },
    "name": {
      "type": "string",
      "pattern": "^[a-z][a-z0-9_-]{0,31}$",
      "description": "Nom de la commande tel que tapé en jeu, sans le slash. Lowercase + chiffres + _ -. Doit être unique sur le serveur (Artisan détecte les conflits avec les commandes existantes)."
    },
    "aliases": {
      "type": "array",
      "items": { "type": "string", "pattern": "^[a-z][a-z0-9_-]{0,31}$" },
      "uniqueItems": true,
      "description": "Alternatives au nom principal. Toutes pointent vers la même commande."
    },
    "permission": {
      "type": "string",
      "description": "Permission requise pour exécuter la commande. Si absente, accessible à tous (sous réserve des requirements)."
    },
    "description": {
      "type": "string",
      "maxLength": 256,
      "description": "Description courte affichée dans la liste des commandes du serveur. Visible par les joueurs."
    },
    "notes": {
      "type": "string",
      "maxLength": 2048,
      "description": "Notes internes de l'admin (jamais affichées aux joueurs). Survivent au round-trip JSON ↔ YAML."
    },
    "arguments": {
      "type": "array",
      "items": { "$ref": "#/$defs/Argument" },
      "description": "Arguments positionnels, ordonnés. Les arguments required doivent précéder les optionnels."
    },
    "requirements": {
      "type": "array",
      "items": { "$ref": "https://docs.artisanmc.net/schema/menu/v1.json#/$defs/Condition" },
      "description": "Conditions ANDées évaluées avant exécution. Si une échoue, le fallback (s'il existe) est exécuté à la place des actions."
    },
    "actions": {
      "type": "array",
      "minItems": 1,
      "items": { "$ref": "https://docs.artisanmc.net/schema/menu/v1.json#/$defs/Action" },
      "description": "Actions à exécuter quand la commande est appelée. Les arguments résolus sont disponibles via les placeholders %args_<name>%."
    },
    "fallback": {
      "type": "array",
      "items": { "$ref": "https://docs.artisanmc.net/schema/menu/v1.json#/$defs/Action" },
      "description": "Actions à exécuter si les requirements échouent. Typiquement un send_message expliquant pourquoi."
    },
    "cooldown": {
      "$ref": "https://docs.artisanmc.net/schema/menu/v1.json#/$defs/Cooldown",
      "description": "Cooldown entre exécutions. Scope player par défaut."
    },
    "metadata": {
      "type": "object",
      "additionalProperties": true,
      "description": "Métadonnées calculées par l'éditeur. Non éditables manuellement.",
      "properties": {
        "uses_plugins": {
          "type": "array",
          "items": { "type": "string" }
        },
        "created_at": { "type": "string", "format": "date-time" },
        "updated_at": { "type": "string", "format": "date-time" },
        "author": { "type": "string" }
      }
    }
  },
  "$defs": {
    "Argument": {
      "type": "object",
      "additionalProperties": false,
      "required": ["name", "type"],
      "description": "Un argument positionnel typé. Sa valeur résolue est exposée comme placeholder %args_<name>% (et sous-champs dérivés pour les types complexes).",
      "properties": {
        "name": {
          "type": "string",
          "pattern": "^[a-z][a-z0-9_]{0,31}$",
          "description": "Nom de l'argument, exposé comme placeholder %args_<name>%."
        },
        "type": {
          "type": "string",
          "enum": ["player", "online_player", "string", "integer", "number", "boolean", "world", "enum"],
          "description": "Type de l'argument. Détermine le parser et la tab-completion. player = online ou offline (résolu via UUID). online_player = connecté requis. enum = valeurs fixées par l'admin (cf. champ values)."
        },
        "required": {
          "type": "boolean",
          "default": true,
          "description": "Si false, l'argument peut être omis. Les optionnels doivent suivre les required dans la liste."
        },
        "default": {
          "description": "Valeur par défaut si l'argument est omis. Peut contenir des placeholders (ex: \"%player_name%\" pour cibler le joueur lui-même par défaut). Type doit correspondre au champ type."
        },
        "values": {
          "type": "array",
          "items": { "type": "string" },
          "minItems": 1,
          "description": "Valeurs autorisées pour les arguments de type enum. Sert aussi à la tab-completion. Requis si type === \"enum\"."
        },
        "description": {
          "type": "string",
          "maxLength": 256,
          "description": "Description affichée à l'aide et au survol dans l'éditeur."
        }
      },
      "allOf": [
        {
          "if": { "properties": { "type": { "const": "enum" } }, "required": ["type"] },
          "then": { "required": ["values"] }
        }
      ]
    }
  }
}
