{
  "schema": "command/v1",
  "id": "heal",
  "name": "heal",
  "aliases": ["soin"],
  "permission": "artisan.cmd.heal",
  "description": "Restaure votre vie et votre faim.",
  "notes": "Commande sans menu — exécution directe d'actions.",
  "actions": [
    { "type": "run_command", "command": "minecraft:effect give @s minecraft:instant_health 1 10 true", "as": "console" },
    { "type": "run_command", "command": "minecraft:effect give @s minecraft:saturation 1 10 true", "as": "console" },
    { "type": "play_sound", "sound": "entity.player.levelup", "volume": 0.5, "pitch": 1.5 },
    { "type": "send_message", "text": "§aVous avez été soigné." }
  ],
  "cooldown": { "id": "heal_cmd", "duration_seconds": 30, "scope": "player", "message": "§cAttendez avant de relancer /heal." }
}
