{
  "schema": "command/v1",
  "id": "profile",
  "name": "profile",
  "aliases": ["p", "stats"],
  "permission": "interfaze.cmd.profile",
  "description": "Affiche le profil d'un joueur.",
  "notes": "Si aucun joueur passé, affiche le profil de l'auteur de la commande grâce au default %player_name%.",
  "arguments": [
    {
      "name": "target",
      "type": "player",
      "required": false,
      "default": "%player_name%",
      "description": "Le joueur à inspecter. Par défaut, vous-même."
    }
  ],
  "actions": [
    { "type": "open_menu", "menu_id": "profile_menu" }
  ]
}
